original,status,successor,search_query,notes,Found,Match_Count,Match1_Name,Match1_CERT,Match1_RSSD,Match1_Status,Match1_Asset,Match1_State,Match1_Address,Match1_City,Match1_Zip,Match1_SimScore,Match2_Name,Match2_CERT,Match2_RSSD,Match2_Status,Match2_Asset,Match2_State,Match2_Address,Match2_City,Match2_Zip,Match2_SimScore
Ameris Bancorp,Active,Ameris Bancorp,Ameris*Bancorp*,Input 'Ameris Bancorp' cleaned (no legal suffixes). Active regional bank.,False,0,,,,,,,,,,,,,,,,,,,,
Apple Bank,Active,Apple Bank,Apple*Bank*,Input 'Apple Bank' is active New York-based bank.,True,2,Apple Bank,16068,249612,Active,18817415.0,NY,122 E 42nd St,New York,10168,1.00,Apple River State Bank,17453,594938,Active,637606.0,IL,103 Main St,Apple River,61001,0.62
Apple Bank for Savings,Active,Apple Bank for Savings,Apple*Bank*for*Savings*,Input 'Apple Bank for Savings' is active savings bank subsidiary.,False,0,,,,,,,,,,,,,,,,,,,,
Arizona Bank,Active,Arizona Bank,Arizona*Bank*,Input 'Arizona Bank' is active regional bank.,True,3,Arizona Bank,18775,585150,Inactive,1327486.0,AZ,120 North Stone Street,Tucson,85702,1.00,Arizona Bank & Trust,57620,3187612,Inactive,1977640.0,AZ,2036 E Camelback Rd,Phoenix,85016,0.77
Arvest Bank,Active,Arvest Bank,Arvest*Bank*,Input 'Arvest Bank' is active Midwest/South regional bank.,True,9,Arvest Bank,8728,311845,Active,27349420.0,AR,75 N East Ave,Fayetteville,72701,1.00,Arvest Bank,3891,970242,Inactive,652970.0,AR,201 West Walnut Street,Rogers,72756,1.00
Associated Bank,Active,Associated Bank,Associated*Bank*,Input 'Associated Bank NA' cleaned (removed NA). Active regional bank.,True,11,Associated Bank North,12340,896445,Inactive,1502068.0,WI,303 South First Avenue,Wausau,54402,0.83,"Associated Bank, National Association",5296,917742,Active,44393788.0,WI,200 N Adams St,Green Bay,54301,0.62
Atlantic Capital Bank,Active,Atlantic Capital Bank,Atlantic*Capital*Bank*,Input 'Atlantic Capital Bank' is active Georgia-based bank.,True,2,Atlantic Capital Bank,58492,3555695,Inactive,1381673.0,GA,"3280 Peachtree Road, Suite 1600",Atlanta,30305,1.00,"Atlantic Capital Bank, National Association",35525,3555695,Inactive,3818842.0,GA,945 E Paces Ferry Rd Ne,Atlanta,30326,0.70
Atlantic Union Bank,Active,Atlantic Union Bank,Atlantic*Union*Bank*,Input 'Atlantic Union Bank' is active Virginia-based bank.,True,1,Atlantic Union Bank,34589,693224,Active,36991202.0,VA,1051 E Cary St,Richmond City,23219,1.00,,,,,,,,,,
Australian & New Zealand Bank Group (New York),Active,Australian & New Zealand Bank Group (New York),Australian*&*New*Zealand*Bank*Group*(New*York)*,Input 'Australian & New Zealand Bank Group (New York)' is active ANZ subsidiary in NY.,True,10,National Exchange Bank and Trust,10044,722544,Active,2919051.0,WI,130 S Main St,Fond Du Lac,54935,0.40,Isabella Bank,1005,74140,Active,2210646.0,MI,139 E Broadway St,Mount Pleasant,48858,0.32
Axos Bank,Active,Axos Bank,Axos*Bank*,Input 'Axos Bank' is active online bank.,True,1,Axos Bank,35546,2917317,Active,26345444.0,CA,4350 La Jolla Village Dr,San Diego,92122,1.00,,,,,,,,,,
BAC Florida Bank,Active,BAC Florida Bank,BAC*Florida*Bank*,Input 'BAC Florida Bank' is active Bank of America subsidiary.,False,0,,,,,,,,,,,,,,,,,,,,
BAC International Bank,Active,BAC International Bank,BAC*International*Bank*,Input 'BAC International Bank Inc' cleaned (removed Inc). Active.,False,0,,,,,,,,,,,,,,,,,,,,
BBVA Compass,Acquired,PNC Bank,(BBVA*Compass* OR PNC*Bank*),Input 'BBVA Compass' acquired by PNC Bank in 2021.,True,10,"PNC Bank, National Association",6384,817824,Active,563953196.0,DE,222 Delaware Ave,Wilmington,19801,0.29,"PNC Bank, Kentucky, Inc.",10513,940348,Inactive,4877290.0,KY,500 West Jefferson Street,Louisville,40202,0.15
BMO Harris Bank,Active,BMO Harris Bank,BMO*Harris*Bank*,Input 'BMO Harris Bank NA' cleaned (removed NA). Active BMO US subsidiary.,True,1,BMO Harris Central National Association,58216,3353154,Active,8188.0,IL,110 E Irving Park Rd,Roselle,60172,0.51,,,,,,,,,,
BMO Harris Bank,Active,BMO Harris Bank,BMO*Harris*Bank*,Input 'BMO/Harris Bank' expanded to BMO Harris Bank. Active.,True,1,BMO Harris Central National Association,58216,3353154,Active,8188.0,IL,110 E Irving Park Rd,Roselle,60172,0.51,,,,,,,,,,
BOK Financial,Active,BOK Financial,BOK*Financial*,Input 'BOK Financial Corp' cleaned (removed Corp). Active Oklahoma-based bank.,False,0,,,,,,,,,,,,,,,,,,,,
BOKF,Active,BOKF,BOKF*,Input 'BOKF NA' cleaned (removed NA). Active BOK Financial subsidiary.,True,1,"BOKF, National Association",4214,339858,Active,49918282.0,OK,1 Williams Ctr,Tulsa,74172,0.31,,,,,,,,,,
BPR Bank,Active,BPR Bank,BPR*Bank*,Input 'BPR Bank' is active regional bank.,False,0,,,,,,,,,,,,,,,,,,,,
Banc of California,Active,Banc of California,Banc*of*California*,Input 'Banc of California' is active California-based bank.,True,2,Banc of California,24045,494261,Active,33923978.0,CA,11611 San Vicente Blvd,Los Angeles,90049,1.00,"Banc of California, National Association",35498,200378,Inactive,9238916.0,CA,3 Macarthur Pl,Santa Ana,92707,0.67
BancAlliance,Active,BancAlliance,BancAlliance*,Input 'BancAlliance Inc' cleaned (removed Inc). Active financial services firm.,False,0,,,,,,,,,,,,,,,,,,,,
CommerceOne Bank,Active,CommerceOne Bank,CommerceOne*Bank*,Input 'CommerceOne Bank' no corrections. Active community bank.,True,1,CommerceOne Bank,59114,5227101,Active,838987.0,AL,17 20th St N,Birmingham,35203,1.00,,,,,,,,,,
Commercial Bank,Active,Commercial Bank,Commercial*Bank*,Input 'Commercial Bank' no corrections. Active regional bank.,True,10,Commercial Bank,11777,296559,Active,361772.0,KS,1901 Main St,Parsons,67357,1.00,"Commercial Bank of Texas, National Association",1209,885869,Active,1641934.0,TX,215 E Main St,Nacogdoches,75961,0.53
Compass Bank,Acquired,PNC Bank,(Compass*Bank* OR PNC*Bank*),Input 'Compass Bank' acquired 2021 via BBVA USA merger by PNC Bank.,True,2,Compass Savings Bank,29430,373272,Active,57935.0,PA,111 Westinghouse Ave,Wilmerding,15148,0.75,"PNC Bank, National Association",6384,817824,Active,563953196.0,DE,222 Delaware Ave,Wilmington,19801,0.32
Compeer Financial,Active,Compeer Financial,Compeer*Financial*,Input 'Compeer Financial' no corrections. Active farm credit entity.,False,0,,,,,,,,,,,,,,,,,,,,
Concentra Bank,Acquired,First Horizon Bank,(Concentra*Bank* OR First*Horizon*Bank*),Input 'Concentra Bank' acquired 2021 by First Horizon Bank.,True,1,First Horizon Bank,4977,485559,Active,82886598.0,TN,165 Madison Ave,Memphis,38103,0.44,,,,,,,,,,
Congressional Bank,Acquired,EagleBank,(Congressional*Bank* OR Eagle*Bank*),Input 'Congressional Bank' merged 2019 into EagleBank.,True,8,EagleBank,34742,2652092,Active,10763529.0,MD,7500 Old Georgetown Rd,Bethesda,20814,0.44,Eaglemark Savings Bank,34313,2605566,Active,762258.0,NV,9850 Double R Blvd,Reno,89521,0.40
Cornerstone Bank,Active,Cornerstone Bank,Cornerstone*Bank*,Input 'Cornerstone Bank' no corrections. Active community bank.,True,9,Cornerstone Bank,13198,879457,Active,1751016.0,ND,2280 45th St S,Fargo,58104,1.00,Cornerstone Bank,5496,403151,Active,2774024.0,NE,529 N Lincoln Ave,York,68467,1.00
Credit Suisse AG New York Branch,Acquired,UBS Group AG,(Credit*Suisse*AG*New*York*Branch* OR UBS*Group*),Input 'Credit Suisse AG New York Branch' acquired 2023 by UBS Group AG.,False,0,,,,,,,,,,,,,,,,,,,,
Credit Suisse New York,Acquired,UBS Group AG,(Credit*Suisse*New*York* OR UBS*Group*),"Input 'Credit Suisse New York' refers to CS AG NY Branch, acquired 2023 by UBS.",False,0,,,,,,,,,,,,,,,,,,,,
Cross River Bank,Active,Cross River Bank,Cross*River*Bank*,Input 'Cross River Bank' no corrections. Active fintech-focused bank.,True,1,Cross River Bank,58410,3783313,Active,8120330.0,NJ,2115 Linwood Ave,Fort Lee,07024,1.00,,,,,,,,,,
CrossFirst Bank,Active,CrossFirst Bank,CrossFirst*Bank*,Input 'CrossFirst Bank' no corrections. Active regional bank.,True,2,CrossFirst Bank,58648,3594005,Inactive,7447108.0,KS,11440 Tomahawk Creek Pkwy,Leawood,66211,1.00,CrossFirst Bank Leawood,57303,3045299,Inactive,92080.0,KS,4707 West 135th Street,Leawood,66224,0.79
Customers Bank,Active,Customers Bank,Customers*Bank*,Input 'Customers Bank' no corrections. Active community bank.,True,1,Customers Bank,34444,2354985,Active,24261355.0,PA,40 General Warren Blvd,Malvern,19355,1.00,,,,,,,,,,
Dart Bank,Active,Dart Bank,Dart*Bank*,Input 'Dart Bank' no corrections. Active Michigan community bank.,True,4,Dartmouth Bank,26700,595476,Inactive,877159.0,NH,156 Hanover Street,Manchester,03105,0.78,Dartmouth Banking Company,26697,309301,Inactive,280013.0,NH,40 South Main Street,Hanover,03755,0.69
Deutsche Bank AG New York Branch,Active,Deutsche Bank AG New York Branch,Deutsche*Bank*AG*New*York*Branch*,Input 'Deutsche Bank AG New York Branch' no corrections. Active global bank branch.,False,0,,,,,,,,,,,,,,,,,,,,
Deutsche Bank New York,Active,Deutsche Bank AG New York Branch,Deutsche*Bank*New*York*,"Input 'Deutsche Bank New York' refers to DB AG NY Branch, active.",False,0,,,,,,,,,,,,,,,,,,,,
Deutsche Bank Trust Co Americas,Active,Deutsche Bank Trust Co Americas,Deutsche*Bank*Trust*Co*Americas*,Input 'Deutsche Bank Trust Co Americas' no corrections. Active subsidiary.,True,1,Deutsche Bank Trust Company Americas,623,214807,Active,40293000.0,NY,1 Columbus Cir,New York,10019,1.00,,,,,,,,,,
Devon Bank,Active,Devon Bank,Devon*Bank*,Input 'Devon Bank' no corrections. Active Oklahoma community bank.,True,1,Devon Bank,16249,347639,Active,469655.0,IL,6445 N Western Ave,Chicago,60645,1.00,,,,,,,,,,
Dime Community Bank,Active,Dime Community Bank,Dime*Community*Bank*,Input 'Dime Community Bank' no corrections. Active NY community bank.,True,2,Dime Community Bank,6976,23504,Active,14528464.0,NY,898 Veterans Memorial Hwy,Hauppauge,11788,1.00,Dime Community Bank,16012,924405,Inactive,6775780.0,NY,149 Kent Avenue,Brooklyn,11249,1.00
Dime Savings Bank of New York,Acquired,JPMorgan Chase,(Dime*Savings*Bank*of*New*York* OR JPMorgan*Chase*),Input 'Dime Saving Bank' corrected to 'Savings'. Acquired via WaMu (2002) then JPMorgan Chase (2008).,True,2,"JPMorgan Chase Bank, National Association",628,852218,Active,3813431000.0,OH,1111 Polaris Pkwy,Columbus,43240,0.30,"JPMorgan Chase Bank, Dearborn",21761,651448,Active,69891.0,MI,18800 Hubbard Dr,Dearborn,48126,0.39
Dollar Bank,Active,Dollar Bank,Dollar*Bank*,Input 'Dollar Bank' no corrections. Active Pennsylvania regional bank.,True,6,Dollar Savings Bank,27938,442075,Inactive,85810.0,PA,"Washington Centre, 32 North Mill Street",New Castle,16103,0.73,"Dollar Bank, Federal Savings Bank",32245,961624,Active,12219114.0,PA,340 4th Ave,Pittsburgh,15222,0.51
California Bank & Trust,Active,California Bank & Trust,California*Bank*&*Trust*,"Input correct, active community bank in California.",True,1,California Bank & Trust,20852,837260,Inactive,11960432.0,CA,"11622 El Camino Real, Suite 200",San Diego,92130,1.00,,,,,,,,,,
California Bank of Commerce,Acquired,U.S. Bank,(California*Bank*of*Commerce* OR U.S.*Bank*),"Acquired 2022 by Union Bank, later merged into U.S. Bank; current holder is U.S. Bank.",True,2,"California Bank of Commerce, National Association",57044,3076453,Active,4098937.0,CA,12265 El Camino Real,San Diego,92130,0.73,U.S. Bank National Association,6548,504713,Active,679293260.0,OH,425 Walnut St,Cincinnati,45202,0.33
Cambridge Savings Bank,Active,Cambridge Savings Bank,Cambridge*Savings*Bank*,"Correct, active mutual savings bank in Massachusetts.",True,1,Cambridge Savings Bank,17870,758703,Active,6950279.0,MA,1374 Massachusetts Ave,Cambridge,02138,1.00,,,,,,,,,,
Camden National Bank,Active,Camden National Bank,Camden*National*Bank*,"Correct, active community bank in Maine.",True,2,The Camden National Bank,4255,593007,Active,6970257.0,ME,2 Elm St,Camden,04843,0.89,"Norwest Bank Camden, National Association",1927,35356,Inactive,128093.0,MN,4141 Lyndale Avenue North,Minneapolis,55412,0.56
Canadian Imperial Bank of Commerce New York,Active,Canadian Imperial Bank of Commerce New York,Canadian*Imperial*Bank*of*Commerce*New*York*,"Correct, active branch of CIBC in New York.",True,1,Canadian Imperial Bank of Commerce (New York),20811,610904,Inactive,55893.0,NY,425 Lexington Avenue,New York,10017,1.00,,,,,,,,,,
Canandaigua National Bank & Trust,Active,Canandaigua National Bank & Trust,Canandaigua*National*Bank*&*Trust*,"Correct, active community bank in New York.",True,1,The Canandaigua National Bank and Trust Company,6985,161602,Active,5258602.0,NY,72 S Main St,Canandaigua,14424,0.89,,,,,,,,,,
Capital Bank,Active,Capital Bank,Capital*Bank*,"Input 'Capital Bank NA' cleaned (removed NA), active national bank in North Carolina.",True,5,Capital Bank,19401,596156,Active,674058.0,TX,10304 East Fwy,Jacinto City,77029,1.00,Capital City Bank,9622,876634,Active,4325546.0,FL,217 N Monroe St,Tallahassee,32301,0.83
Capital Farm Credit,Active,Capital Farm Credit,Capital*Farm*Credit*,"Correct, active agricultural credit institution.",False,0,,,,,,,,,,,,,,,,,,,,
Capital One Bank,Active,Capital One Bank,Capital*One*Bank*,"Correct, active major national bank.",True,1,"Capital One Bank (USA), National Association",33954,2253891,Inactive,127600243.0,VA,4851 Cox Rd,Glen Allen,23060,0.59,,,,,,,,,,
Capital One,Active,Capital One,Capital*One*,"Input 'Capital One NA' cleaned (removed NA), active.",True,3,"Capital One, F.S.B.",34191,2478407,Inactive,17487074.0,VA,1680 Capital One Drive,Mclean,22102,0.85,"Capital One, National Association",4297,112837,Active,652138082.0,VA,1680 Capital One Dr,Mclean,22102,0.55
Carver Federal Savings Bank,Active,Carver Federal Savings Bank,Carver*Federal*Savings*Bank*,"Correct, active minority-owned savings bank in New York.",True,1,Carver Federal Savings Bank,30394,268677,Active,702912.0,NY,75 W 125th St,New York,10027,1.00,,,,,,,,,,
Cathay Bank,Active,Cathay Bank,Cathay*Bank*,"Correct, active Asian-American owned bank in California.",True,1,Cathay Bank,18503,595869,Active,24059479.0,CA,777 N Broadway,Los Angeles,90012,1.00,,,,,,,,,,
Centennial Bank,Active,Centennial Bank,Centennial*Bank*,"Correct, active regional bank (Arkansas-based).",True,2,Centennial Bank,11241,456045,Active,22542008.0,AR,620 Chestnut St,Conway,72032,1.00,Centennial Bank,8439,531250,Active,835475.0,TN,5420 Broad St S,Trezevant,38258,1.00
Centennial Bank Holdings,Acquired,Home BancShares,(Centennial*Bank*Holdings* OR Home*BancShares*),"Input 'Centennial Bank Holdings Inc' cleaned (removed Inc), acquired 2019 by Home BancShares.",False,0,,,,,,,,,,,,,,,,,,,,
CenterState Bank,Acquired,SouthState Bank,(CenterState*Bank* OR SouthState*Bank*),Merged 2020 with SouthState Bank to form SouthState Bank; current successor is SouthState Bank.,True,6,CenterState Bank of Florida,35313,2905538,Inactive,181447.0,FL,1101 First Street South,Winter Haven,33880,0.74,"SouthState Bank, National Association",33555,1929247,Active,66027921.0,FL,1101 1st St S,Winter Haven,33880,0.45
Centier Bank,Active,Centier Bank,Centier*Bank*,"Correct, active community bank in Indiana.",True,1,Centier Bank,12854,783648,Active,9917852.0,IN,1500 119th St,Whiting,46394,1.00,,,,,,,,,,
Central Pacific Bank,Active,Central Pacific Bank,Central*Pacific*Bank*,"Correct, active regional bank in Hawaii.",True,1,Central Pacific Bank,17308,701062,Active,7415416.0,HI,220 S King St,Honolulu,96813,1.00,,,,,,,,,,
Century Bank,Active,Century Bank,Century*Bank*,"Correct, active community bank (e.g., Massachusetts-based).",True,9,Century Bank,11448,58636,Active,550820.0,MS,4282 Main St,Lucedale,39452,1.00,Century Bank,28362,83375,Active,1364303.0,NM,100 S Federal Pl,Santa Fe,87501,1.00
Chambers Bank,Active,Chambers Bank,Chambers*Bank*,"Correct, active community bank in Arkansas.",True,2,Chambers Bank,5615,517049,Active,1453244.0,AR,901 Main St,Danville,72833,1.00,Chambers State Bank,13251,416357,Active,83369.0,NE,104 E Main St,Chambers,68725,0.81
China Construction Bank Corporation New York,Active,China Construction Bank Corporation New York,China*Construction*Bank*Corporation*New*York*,"Input cleaned (removed 'Branch' suffix), active branch of CCB in New York.",False,0,,,,,,,,,,,,,,,,,,,,
Farm Credit Mid-America PCA,Active,Farm Credit Mid-America PCA,Farm*Credit*Mid-America*PCA*,No typos; active Farm Credit institution.,False,0,,,,,,,,,,,,,,,,,,,,
Farm Credit Services of America,Active,Farm Credit Services of America,Farm*Credit*Services*of*America*,Active member of the Farm Credit System.,False,0,,,,,,,,,,,,,,,,,,,,
Farm Credit Services of America FLCA,Active,Farm Credit Services of America FLCA,Farm*Credit*Services*of*America*FLCA*,No typos; active Federal Land Credit Association.,False,0,,,,,,,,,,,,,,,,,,,,
Farm Credit West FLCA,Active,Farm Credit West FLCA,Farm*Credit*West*FLCA*,Active entity within Farm Credit West.,False,0,,,,,,,,,,,,,,,,,,,,
Farmers & Merchants Bank,Active,Farmers & Merchants Bank,Farmers*&*Merchants*Bank*,Corrected 'Merchant' to 'Merchants'; active regional bank.,True,10,Farmers & Merchants Bank,12284,273859,Active,19173.0,OK,101 East Second Street,Duke,73532,1.00,Farmers & Merchants Bank of Central California,1331,808260,Active,5631419.0,CA,121 W Pine St,Lodi,95240,0.68
Fifth Third Bank,Active,Fifth Third Bank,Fifth*Third*Bank*,Active Ohio-based regional bank.,True,11,"FIFTH THIRD BANK, INDIANA",12843,976749,Inactive,2105919.0,IN,120 Monument Circle,Indianapolis,46204,0.80,"Fifth Third Bank, National Association",6672,723112,Active,212207000.0,OH,38 Fountain Square Plz,Cincinnati,45202,0.64
First Bank Chicago,Active,First Bank Chicago,First*Bank*Chicago*,Active Chicago community bank.,True,4,First Bank Chicago,17470,804338,Active,2090794.0,IL,1835 1st St,Highland Park,60035,1.00,First State Bank of Chicago,20170,191636,Inactive,219199.0,IL,4646 North Cumberland Avenue,Chicago,60656,0.80
First Bank,Active,First Bank,First*Bank*,Removed legal suffix 'NA'; active.,True,10,First Southern Bank,10055,631039,Active,324134.0,GA,930 Memorial Dr,Waycross,31501,0.69,First International Bank & Trust,10248,236153,Active,5680943.0,ND,100 N Main St,Watford City,58854,0.49
First Bank Puerto Rico,Active,First Bank Puerto Rico,First*Bank*Puerto*Rico*,Active Puerto Rican financial institution.,True,1,FirstBank Puerto Rico,30387,510871,Active,19300144.0,PR,1519 Ave Ponce De Leon,Santurce,00909,0.98,,,,,,,,,,
First Bank of Highland Park,Active,First Bank of Highland Park,First*Bank*of*Highland*Park*,Active community bank in Highland Park.,False,0,,,,,,,,,,,,,,,,,,,,
First Citizens Bank & Trust,Active,First Citizens Bank & Trust,First*Citizens*Bank*&*Trust*,Active regional bank with trust services.,True,3,First-Citizens Bank & Trust Company,11063,491224,Active,233167000.0,NC,239 Fayetteville St,Raleigh,27601,0.98,First Citizens Bank & Trust Company,10003,794831,Inactive,126549.0,WV,1 East Main Street,White Sulphur Springs,24986,1.00
First Commercial Bank Los Angeles,Active,First Commercial Bank Los Angeles,First*Commercial*Bank*Los*Angeles*,Active Los Angeles-based commercial bank.,False,0,,,,,,,,,,,,,,,,,,,,
First Commonwealth Bank,Active,First Commonwealth Bank,First*Commonwealth*Bank*,Active Pennsylvania regional bank.,True,3,First Commonwealth Bank,7468,42420,Active,12279028.0,PA,654 Philadelphia St,Indiana,15701,1.00,First Commonwealth Bank,24682,864127,Inactive,61885.0,VA,204 West Main Street,Wise,24293,1.00
First Eagle Bank,Active,First Eagle Bank,First*Eagle*Bank*,Active community bank.,True,1,First Eagle  Bank,25883,759045,Active,617101.0,IL,1201 W Madison St,Chicago,60607,0.97,,,,,,,,,,
First Financial Bank,Active,First Financial Bank,First*Financial*Bank*,Active regional bank with multiple locations.,True,6,First Financial Bank,19440,292234,Active,242019.0,AL,1630 4th Ave N,Bessemer,35020,1.00,First Financial Bank,6600,165628,Active,18457048.0,OH,255 E 5th St,Cincinnati,45202,1.00
First Florida Bank,Active,First Florida Bank,First*Florida*Bank*,Active Florida community bank.,True,7,First Florida Bank,35105,2808358,Inactive,399921.0,FL,8850 Tamiami Trail North,Naples,34108,1.00,First Florida Integrity Bank,58532,3591282,Inactive,2389982.0,FL,3580 Pine Ridge Road,Naples,34109,0.78
First Foundation Bank,Active,First Foundation Bank,First*Foundation*Bank*,Active bank with wealth management services.,True,1,First Foundation Bank,58647,3637685,Active,11886084.0,CA,18101 Von Karman Ave,Irvine,92612,1.00,,,,,,,,,,
First Hawaiian Bank,Active,First Hawaiian Bank,First*Hawaiian*Bank*,Active Hawaii-based bank (part of BOH Holdings).,True,1,First Hawaiian Bank,17985,980661,Active,24101748.0,HI,999 Bishop St,Honolulu,96813,1.00,,,,,,,,,,
First Horizon Bank,Active,First Horizon Bank,First*Horizon*Bank*,Active Tennessee regional bank.,True,1,First Horizon Bank,4977,485559,Active,82886598.0,TN,165 Madison Ave,Memphis,38103,1.00,,,,,,,,,,
First Independence Bank,Active,First Independence Bank,First*Independence*Bank*,Active African-American owned community bank.,True,2,First Independence Bank,20179,254849,Active,699585.0,MI,7310 Woodward Ave,Detroit,48202,1.00,First Independence Bank of Florida,23929,68336,Inactive,65048.0,FL,"16740 San Carlos Boulevard, S.W.",Fort Myers,33908,0.81
China Merchants Bank New York,Active,China Merchants Bank New York,China*Merchants*Bank*New*York*,Input correct; active US branch of China Merchants Bank.,False,0,,,,,,,,,,,,,,,,,,,,
Choice Bank,Active,Choice Bank,Choice*Bank*,Input correct; active regional bank.,True,4,Choice Bank,57469,3161993,Inactive,287610.0,AZ,15190 North Hayden Road,Scottsdale,85260,1.00,ChoiceOne Bank,1014,324340,Active,4291775.0,MI,109 E Division St,Sparta,49345,0.88
Citibank,Active,Citibank,Citibank*,Input 'Citi' expanded to 'Citibank'; active.,True,11,Citibank USA,27606,1404931,Inactive,2423684.0,DE,4500 New Linden Hill Road,Wilmington,19808,0.80,"Citibank, National Association",7213,476810,Active,1844189000.0,SD,5800 S Corporate Pl,Sioux Falls,57108,0.47
Citibank,Active,Citibank,Citibank*,Input correct; active.,True,11,Citibank USA,27606,1404931,Inactive,2423684.0,DE,4500 New Linden Hill Road,Wilmington,19808,0.80,"Citibank, National Association",7213,476810,Active,1844189000.0,SD,5800 S Corporate Pl,Sioux Falls,57108,0.47
Citibank,Active,Citibank,Citibank*,Input 'Citibank NA' cleaned (removed NA); active.,True,11,Citibank USA,27606,1404931,Inactive,2423684.0,DE,4500 New Linden Hill Road,Wilmington,19808,0.80,"Citibank, National Association",7213,476810,Active,1844189000.0,SD,5800 S Corporate Pl,Sioux Falls,57108,0.47
Citicorp North America,Active,Citicorp North America,Citicorp*North*America*,Input 'Citicorp North America Inc' cleaned (removed Inc); active subsidiary of Citigroup.,False,0,,,,,,,,,,,,,,,,,,,,
Citigroup,Active,Citigroup,Citigroup*,Input correct; active financial holding company.,False,0,,,,,,,,,,,,,,,,,,,,
Citizens Bank,Active,Citizens Bank,Citizens*Bank*,Input 'Citizens Bank NA' cleaned (removed NA); active.,True,10,Citizens State Bank,10474,356239,Active,447664.0,IL,102 W Main St,Lena,61048,0.81,Citizens and Farmers Bank,10363,928421,Active,2686839.0,VA,415 14th Street,West Point,23181,0.68
Citizens Financial Group,Active,Citizens Financial Group,Citizens*Financial*Group*,Input correct; active holding company for Citizens Bank.,True,3,Citizens Financial Bank,29367,163473,Inactive,1117907.0,IN,707 Ridge Road,Munster,46321,0.81,Citizens First Financial Bank,9809,891552,Inactive,89027.0,MO,40 South Walnut Street,Dexter,63841,0.72
Citizens National Bank,Active,Citizens National Bank,Citizens*National*Bank*,Input correct; active regional bank.,True,8,Citizens National Bank,20954,717737,Active,1926540.0,TN,200 Forks Of The River Pkwy,Sevierville,37862,1.00,Citizens National Bank of Texas,5574,552161,Active,2026072.0,TX,200 N Elm St,Waxahachie,75165,0.81
City National Bank,Active,City National Bank,City*National*Bank*,Input correct; active (owned by RBC but operates independently).,True,4,City National Bank,17281,63069,Active,96473902.0,CA,555 S Flower St,Los Angeles,90071,1.00,City National Bank of Florida,20234,814430,Active,27770671.0,FL,25 W Flagler St,Miami,33130,0.73
Citywide Banks,Active,Citywide Banks,Citywide*Banks*,Input correct; active Colorado regional bank.,True,1,Citywide Banks,19858,697754,Inactive,1381509.0,CO,10660 East Colfax Avenue,Aurora,80010,1.00,,,,,,,,,,
Civista Bank,Active,Civista Bank,Civista*Bank*,Input correct; active Ohio regional bank.,True,1,Civista Bank,12982,542528,Active,4105295.0,OH,100 E Water St,Sandusky,44870,1.00,,,,,,,,,,
CoBank,Active,CoBank,CoBank*,Input correct; active US agricultural cooperative bank.,True,1,CerescoBank,1993,75651,Active,76595.0,NE,130 Elm St,Ceresco,68017,0.71,,,,,,,,,,
Columbia Bank,Active,Columbia Bank,Columbia*Bank*,Input correct; active Washington regional bank.,True,2,Columbia Bank,17266,143662,Active,67491443.0,OR,445 Se Main St,Roseburg,97470,1.00,Columbia Bank,28834,174572,Active,10858331.0,NJ,19-01 Route 208,Fair Lawn,07410,1.00
Columbia State Bank,Active,Columbia State Bank,Columbia*State*Bank*,Input correct; active regional bank.,True,1,Columbia State Bank,33826,2078290,Inactive,20258988.0,WA,1301 A St,Tacoma,98402,1.00,,,,,,,,,,
Comerica Bank,Active,Comerica Bank,Comerica*Bank*,Input correct; active Texas regional bank.,True,2,Comerica Bank,983,60143,Active,77366000.0,TX,1717 Main St,Dallas,75201,1.00,"Comerica Bank & Trust, National Association",1596,772446,Active,126282.0,MI,101 N Main St,Ann Arbor,48104,0.51
Comerica Bank,Active,Comerica Bank,Comerica*Bank*,Input 'Comerica Bank NA' cleaned (removed NA); active.,True,2,Comerica Bank,983,60143,Active,77366000.0,TX,1717 Main St,Dallas,75201,1.00,"Comerica Bank & Trust, National Association",1596,772446,Active,126282.0,MI,101 N Main St,Ann Arbor,48104,0.51
Commerce Bancorp,Acquired,TD Bank,(Commerce*Bancorp* OR TD*Bank*),Input 'Commerce Bancorp Inc' cleaned (removed Inc); acquired by TD Bank in 2008.,True,2,"TD Bank, National Association",18409,497404,Active,350851701.0,DE,2035 Limestone Rd,Wilmington,19808,0.29,"TD Bank USA, National Association",33947,2121196,Active,34297872.0,DE,2035 Limestone Rd,Wilmington,19808,0.27
